{
  "version": "0.1.0-draft",
  "kind": "resilient_integration_report",
  "format": "foundation-resilient-integration-report-v2",
  "status": "passed",
  "scope": "resilient_contract_certificate_e2e",
  "evidence_class": "solver_checked",
  "claim_scope": "smt_queries",
  "source_binding": "regenerated",
  "capability_ids": [
    "source-frontend",
    "contract-verification",
    "proof-certificates"
  ],
  "inventoried_capability_ids": [
    "source-frontend",
    "contract-verification",
    "proof-certificates",
    "signed-certificates",
    "recovery-and-effects",
    "information-flow",
    "resource-contracts",
    "temporal-refinement",
    "embedded-runtime",
    "mutation-and-regression",
    "tooling-and-lsp"
  ],
  "inventory_sha256": "14b1b4c9ef1a4dc6399a4497071da59fab1e84190274eee5f6e8d26b9cc37a53",
  "source_sha256": "4b01b8eb2558bdc32e407ebd7a4fce1f4e6dbeacfa477f5a02c50e1494dd0ce1",
  "certificate_sha256": "7580fb52e7ec80f28ac60241cfb4b27471f6b872cee94dd6bf92f2d0b6e5d86f",
  "proof_manifest_sha256": "5c2ce760fde030b8060d6ec13f7d0ccce7d5468c63e50aa30597f2296e57aec9",
  "build": {
    "status": "prebuilt",
    "binary_sha256": "4187be52e66647b22f09caac69f35b4ed934ec8a1da81cbda3270fc8814c0ee8",
    "assumption": "Caller-selected trusted binary; build provenance is not independently proved."
  },
  "emit": {
    "command": [
      "/home/eric/autopilot-runs/resilient-agent-20261012/Resilient/resilient/target/release/rz",
      "--no-cache",
      "--typecheck",
      "--emit-contract-certificate",
      "/home/eric/autopilot-runs/resilient-agent-20261012/Resilient-Foundation/artifacts/resilient-tools-regenerated/contract-certificate.json",
      "--emit-certificate",
      "/home/eric/autopilot-runs/resilient-agent-20261012/Resilient-Foundation/artifacts/resilient-tools-regenerated/proofs",
      "/home/eric/autopilot-runs/resilient-agent-20261012/Resilient-Foundation/artifacts/resilient-tools-regenerated/source/cert_demo_pass.rz"
    ],
    "seconds": 0.028,
    "stdout": "Running type checker...\n\u001b[32mType check passed\u001b[0m\n\u001b[36mWrote 1 verification certificate(s)\u001b[0m\n\u001b[36mWrote contract certificate to /home/eric/autopilot-runs/resilient-agent-20261012/Resilient-Foundation/artifacts/resilient-tools-regenerated/contract-certificate.json\u001b[0m\nProgram executed successfully\n",
    "stderr": "seed=18295395036708356603\nmutation: 1 total mutation site(s) across 1 function(s)\nmutation:   `ident_round`: 1 site(s) [return]\nwarning: /home/eric/autopilot-runs/resilient-agent-20261012/Resilient-Foundation/artifacts/resilient-tools-regenerated/source/cert_demo_pass.rz:3:4: function `ident_round` is never called\n"
  },
  "replay": {
    "status": "passed",
    "solver": {
      "name": "z3",
      "sha256": "c05be002097e2f2106efeeac03e58032e3f5cca10104f95d7a0ddc0bd3f907cb"
    },
    "queries": [
      {
        "id": "contract:ident_round:0:requires",
        "sha256": "36527ced94a4adc6ca2f2cbb14c9436d7ca68f33d6e3ef9e8737f615f2a37444",
        "result": "unsat"
      },
      {
        "id": "manifest:ident_round__decl__0.smt2",
        "sha256": "36527ced94a4adc6ca2f2cbb14c9436d7ca68f33d6e3ef9e8737f615f2a37444",
        "result": "unsat"
      }
    ]
  },
  "receipt": {
    "status": "passed",
    "format": "foundation-resilient-check-receipt-v2",
    "evidence_sha256": "3fb416f368758c93bd882eab51fda4e5874cbc7fe7a6bbe457b1a84b602f33cf",
    "source_sha256": "4b01b8eb2558bdc32e407ebd7a4fce1f4e6dbeacfa477f5a02c50e1494dd0ce1",
    "inventory_sha256": "14b1b4c9ef1a4dc6399a4497071da59fab1e84190274eee5f6e8d26b9cc37a53",
    "evidence_class": "solver_checked",
    "claim_scope": "smt_queries",
    "source_binding": "regenerated"
  },
  "cases": [
    {
      "id": "regenerate-and-replay",
      "status": "passed"
    },
    {
      "id": "verify-complete-record",
      "status": "passed"
    },
    {
      "id": "source-identity-mutation",
      "status": "passed",
      "outcome": "InvalidEvidence"
    },
    {
      "id": "stale-certificate-reimport",
      "status": "passed",
      "outcome": "InvalidEvidence"
    },
    {
      "id": "forged-assurance",
      "status": "passed",
      "outcome": "InvalidEvidence"
    },
    {
      "id": "replay-downgrade",
      "status": "passed",
      "outcome": "InvalidEvidence"
    },
    {
      "id": "satisfiable-query",
      "status": "passed",
      "outcome": "Refuted"
    },
    {
      "id": "solver-output-spoofing",
      "status": "passed",
      "outcome": "InvalidEvidence"
    }
  ],
  "mutation": {
    "status": "rejected"
  },
  "implementation_hashes": {
    "foundation/resilient.py": "714902b458994f9126ea2b84d26e2c6c6de734b004a0923536a0531a89c2fcff",
    "foundation/source.py": "c5d691f04265dae978cfd35c890f321d02b565cd6e7cfab7275e31b3a7952b39",
    "foundation/cli.py": "865cb1bd8b362acc98298add5c7305349558075a30ab37fca80ef556fcef6d64",
    "foundation/errors.py": "f3906c352bf5105932c57efc120fae5e6e79000b47160ed63c4d8c465966b93b",
    "foundation/ir.py": "a61017043c243ac4e9d53ac9258f4c8b7752ae8d140931e0b7b23c776ad5676c",
    "profiles/scalar-wrapping-v1.json": "2578eab48dc462dc5c4f315d0a43a179b22be180f641b3c799893d5cd0dd235f",
    "schemas/program-ir.schema.json": "e168d4c49e47d5bf5917ea6b1a8c3184d8b80f0492efd6f62299177d1a02f807",
    "profiles/resilient-capabilities.json": "73ab825e1ad59b5595f38c44dca61f74a3f42da09ecc15bf1ed41073399550bf",
    "schemas/resilient-capabilities.schema.json": "fa2a82ac11a763b12b088b581ad5c9749ea5a119430ea14e7ef821812d4877d6",
    "schemas/resilient-integration-report.schema.json": "c2c80da87fb622235445698ff6a378189350b327f8b7e85b7ca5b86012318cd5",
    "profiles/backend-capabilities.json": "68f4fb13c39e4d2681098ff04fb2082421a8dfde93652c142dcb5120c7d79ec9",
    "scripts/validate_spec.py": "f4c4dd1c64264d11e3dce58adb16bcf63663d7c54f5ec993407f09da8100850b",
    "examples/resilient/cert_demo_pass.rz": "4b01b8eb2558bdc32e407ebd7a4fce1f4e6dbeacfa477f5a02c50e1494dd0ce1"
  },
  "test_hashes": {
    "tests/test_resilient.py": "d0f5e8863ba6a06268c0b149c450f8c493ee6d5ef93606bac2ea5f0f9bf11b17"
  },
  "driver_hashes": {
    "scripts/run_resilient_integration.py": "929e69a8f858700270aa62a114dd85589b3c2c2118cd15a18f86778566033a7c",
    "scripts/replay_resilient.py": "3a0903fa1673e94fad66c21b26e078db141709cab7a8a1e722779fc6e03052b0"
  },
  "evidence_files": {
    "validation/resilient/contract-certificate.json": "7580fb52e7ec80f28ac60241cfb4b27471f6b872cee94dd6bf92f2d0b6e5d86f",
    "validation/resilient/evidence.json": "3fb416f368758c93bd882eab51fda4e5874cbc7fe7a6bbe457b1a84b602f33cf",
    "validation/resilient/proofs/ident_round__decl__0.smt2": "36527ced94a4adc6ca2f2cbb14c9436d7ca68f33d6e3ef9e8737f615f2a37444",
    "validation/resilient/proofs/manifest.json": "5c2ce760fde030b8060d6ec13f7d0ccce7d5468c63e50aa30597f2296e57aec9",
    "validation/resilient/source/cert_demo_pass.rz": "4b01b8eb2558bdc32e407ebd7a4fce1f4e6dbeacfa477f5a02c50e1494dd0ce1"
  },
  "tests_run": 26,
  "tests_failed": 0,
  "tests_skipped": 0,
  "assumptions": [
    "Solver evidence covers only the explicitly replayed SMT queries under Z3 trust.",
    "Source regeneration trusts the selected Resilient binary and its encoding; it is not a source-to-query theorem.",
    "Clauses without a query remain compiler-reported and carry no independent solver evidence.",
    "Signatures are retained as artifact identities, not authenticated by this adapter.",
    "Inventory anchors are selected source observations, not proof or execution coverage of those capabilities."
  ]
}
